,Unnamed: 0.2,Unnamed: 0.1,Unnamed: 0,adult,belongs_to_collection,budget,genres,homepage,id,imdb_id,original_language,original_title,overview,popularity,poster_path,production_companies,production_countries,release_date,revenue,runtime,spoken_languages,status,tagline,title,video,vote_average,vote_count,year,cast,crew,keywords,movieId,imdbId,tmdbId
8785,8785,8785,8785,False,,0,"Drama,Comedy,Romance",,43430,tt0073179,Russian,"Ирония судьбы, или С легким паром!","A group of old friends have a tradition of going to a public bathing house on New Years eve. Occasionally too much vodka and beer makes two of them unconscious. The problem is that one of them (Sasha) has to go to Leningrad but another one (Zhenya) goes. Zhenya wakes up at Leningrad airport. Believing that he is still in Moscow he takes a taxi and goes home. The street name, building and even apartment number, the way an apartment complex looks the same and the key coincide completely - just typical Soviet-type 'economy' architecture. Imagine the surprise of Nadya when she enters her apartment and finds a man without trousers in her bed. What's more - Nadya's fiancé also finds him there...",2.694572,http://img.omdbapi.com/?i=tt0073179&h=600&apikey=f3f2af9c,Mosfilm,Russia,1975-12-31,0.0,184.0,Pусский,Released,,"The Irony of Fate, or Enjoy Your Bath!",False,7.2,36.0,1975,"Zhenya-Andrey_Myagkov,Nadya-Barbara_Brylska,Ипполит-Yuriy_Yakovlev,-Aleksandr_Shirvindt,-Georgi_Burkov,-Aleksandr_Belyavskiy,-Liya_Akhedzhakova,-Valentina_Talyzina,-Lyubov_Dobrzhanskaya,-Lyubov_Sokolova,-Olga_Naumenko,-Gotlib_Roninson,-Eldar_Ryazanov",Eldar_Ryazanov,based_on_novel,,,
8864,8864,8864,8864,False,,0,"Drama,Comedy,Crime,Romance",,32689,tt0086153,French,Prénom Carmen,"The protagonist is Carmen X, a female member of a terrorist gang. She asks her uncle Jean, a washed-up film director if she can borrow his beachside house to make a film with some friends, but they are in fact planning to rob a bank. During the robbery she falls in love with a security guard. The film intercuts between Carmen's escape with the guard, her uncle's attempt to make a comeback film, and a string quartet attempting to perform Beethoven.",2.094005,http://img.omdbapi.com/?i=tt0086153&h=600&apikey=f3f2af9c,"Films_A2,Sara_Films,JLG_Films",France,1983-09-04,0.0,85.0,Français,Released,,First Name: Carmen,False,7.1,16.0,1983,"Carmen_X-Maruschka_Detmers,Joseph_Bonnaffé-Jacques_Bonnaffé,Claire-Myriem_Roussel,Le_chef-Christophe_Odent,Oncle_Jeannot-Jean-Luc_Godard,La_nourrice_/_Wet_nurse-Valérie_Dréville",Jean-Luc_Godard,"male_nudity,female_nudity,sex,robbery,based_on_novel,terrorist,bank,hostage,eroticism,kidnapping,nudity,guard,love,money,gang,blood",32689.0,84591.0,31944.0
9097,9097,9097,9097,False,,0,"Comedy,Romance",,58416,tt0110832,Finnish,"Pidä huivista kiinni, Tatjana","Lugubrious Finns Valto and Reino take to the road in search of coffee and vodka, without which their lives are not worth living. But their reveries are interrupted by the arrival of garrulous Russian Klaudia and Estonian Tatiana - who are clearly interested in the two men, despite the language barrier. But what are the chances of getting a response from men who prefer staring at vodka bottles to talking?",0.471183,http://img.omdbapi.com/?i=tt0110832&h=600&apikey=f3f2af9c,"Pandora_Filmproduktion,Sputnik_Oy,Finnish_Film_Foundation",Finland,1994-01-01,0.0,65.0,"suomi,Pусский",Released,,"Take Care of Your Scarf, Tatiana",False,7.2,12.0,1994,"Tatjana-Kati_Outinen,Klavdia-Kirsi_Tykkyläinen,Reino-Matti_Pellonpää,Valto-Mato_Valtonen",Aki_Kaurismäki,"coffee,black_humor,music,cigarette_smoking,vodka,road_movie",,,
9264,9264,9264,9264,False,,0,"Horror,Thriller",,9439,tt0222368,Spanish,Los sin nombre,"The mutilated body of a six year old girl is found in a water hole. The girl is identified as the missing daughter of Claudia. However, only two peices of evidence could be used to identify her; a bracelet with her name on it near the crime scene, and the fact that her right leg was three inches longer than her left. All other methods of identification were removed from her body. Five years later Claudia, now addicted to tranquilizers, receives a phone call from someone claiming to be her daughter, asking for her mother to come find her before 'they' kill her. Other mysterious clues show up, further indicating that Claudia's daughter is indeed still alive, and very much in danger. Claudia, a run-down ex-cop, and a parapsychology reporter put together the clues to discover Angela's whereabouts",2.564327,http://img.omdbapi.com/?i=tt0222368&h=600&apikey=f3f2af9c,Filmax,Spain,1999-10-08,0.0,102.0,Español,Released,Trying to reach the limits of evil... But evil has no limits.,The Nameless,False,4.9,34.0,1999,"Claudia_Horts_de_Gifford-Emma_Vilarasau,Bruno_Massera-Karra_Elejalde,Quiroga-Tristán_Ulloa,Franco-Toni_Sevilla,Marc_Gifford-Brendan_Price",Jaume_Balagueró,"rape,mother_daughter_relationship,call",,,
10006,10006,10006,10006,False,,0,Comedy,,13618,tt0287138,English,Who's Your Daddy?,"An adopted Ohio high school senior discovers he is the inherited heir to a porn empire. Dropped into a bitter power struggle, his new flock of beautiful co-workers come to his aid.",12.241881,http://img.omdbapi.com/?i=tt0287138&h=600&apikey=f3f2af9c,Middle_Fork_Productions,United_States_of_America,2004-01-07,0.0,105.0,English,Released,,Who's Your Daddy?,False,4.6,24.0,2004,"Chris_Hughes-Brandon_Jack_James,Beverly_Hughes-Colleen_Camp,Brookes-Kadeem_Hardison,Kate_Reeves-Christine_Lakin,Elissa_Bauer-Ali_Landry,Brittany_Van_Horn-Marnette_Patterson,Murphy-Robert_Ri'chard,Ms._Harding-Lin_Shaye,Bobby-Josh_Jacobson,Volleyball_Girl-Sarena_Mobley,Duncan_Mack-William_Atherton,Patty_Landry-Jolie_Jenkins,Lori-Leslie_Appleyard,Danny_Hughes-Justin_Berfield,Hudson_Reed-Ryan_Bittle,Katerinna-Tara_Boger,Honey_Mack-Shera_Danese,Heather_McKay-Patsy_Kensit,Austin-Andrew_Leeds,Nat-San_Wang-Alec_Mapa,Kevin_Studney-Harry_S._Murphy,Peter_Mack-Wayne_Newton,Lolli-Pop_Angel-Ileanna_Simancas,Angel_Wanna-Be-Carrie_Stevens,Scooter-Martin_Starr,Adam_Torey-Charlie_Talbert,Carl_Hughes-Dave_Thomas,Michael_Hunt-Robert_Torti,Angel-Allison_McCurdy,Angel-Pamela_Paulshock,Angel-Tanisha_Williams,Angel-Natasha_Diakova,Angel-Azalea_Davila,Angel-Elisha_Choice,The_Arnold_Horshack_Experience-Kevin_Murphy,Mr._Torkenbush-Andrew_Shaifer",Andy_Fickman,sex,,,
10068,10068,10068,10068,False,,0,"Drama,Romance,Thriller",,53116,tt0177747,Spanish,Entre las piernas,"Miranda, a sex addict, works for a radio station and is married to a cop. She signs up for therapy in order to deal with her sex addiction. Also in the group is Javier, a sex-phone junkie. The two misfits hit it off and a torid affair ensues. But things get a little complicated when Javier finds out that this phone sex trysts have been secretly taped and being distributed all over Madrid, and that his ex-wife is living with his business partner. Elsewhere, while investigating a murder case, Felix discovers Miranda's affair with Javier.",1.821541,http://img.omdbapi.com/?i=tt0177747&h=600&apikey=f3f2af9c,"Bocaboca_Producciones_S.A.,Aurum_Producciones","Spain,France",1999-01-22,0.0,115.0,Español,Released,,Between Your Legs,False,5.8,9.0,1999,"Miranda-Victoria_Abril,Javier-Javier_Bardem,Jareño-Juan_Diego,Anastasio-Roberto_Alvarez,Claudio-Sergi_López,Felix-Carmelo_Gómez,-Marina_San_José",Manuel_Gómez_Pereira,"sex,adultery,radio,murder,dog",,,
10537,10537,10537,10537,False,,0,Animation,,31718,tt0076591,English,"Race for Your Life, Charlie Brown","The Peanuts gang, including Snoopy and Woodstock, have gone off to summer camp. After a few days of the usual summer-camp activities, they all take part in a rafting race. Battling treacherous rapids, wild animals, and bullies from a rival camp, the teams make their way downriver to the finish line.",1.219274,http://img.omdbapi.com/?i=tt0076591&h=600&apikey=f3f2af9c,Paramount_Pictures,,1977-08-24,0.0,76.0,English,Released,"It's my new wilderness adventure! The entire ""Peanuts"" gang faces everything from bullies to rampaging rapids. ""Good grief"", will you have fun!","Race for Your Life, Charlie Brown",False,6.6,17.0,1977,"Charlie_Brown_(voice)-Duncan_Watson,Schroeder_(voice)-Greg_Felton,Peppermint_Patty_(voice)-Stuart_Brotman,Sally_Brown_(voice)-Gail_Davis",Phil_Roman,"peanuts,charlie_brown",,,
10597,10597,10597,10597,False,,2500000,"Drama,Mystery,Romance",,47540,tt0337656,English,Keep Your Distance,"In the perfectly normal town of Louisville, KY, there is a perfectly normal man living the perfect life. David Dailey is a man who has it all: A great career, a community that adores him, and an enduring marriage. But beneath the surface, David's idyllic world is crumbling. He's haunted by a series of mysterious notes that warn of an imminent fall from grace...",5.558013,http://img.omdbapi.com/?i=tt0337656&h=600&apikey=f3f2af9c,"Lunacy_Unlimited_Productions,Blue_&_Grey_Film_Ventures",United_States_of_America,2005-09-02,0.0,94.0,English,Released,Everyone you trust has the power to betray you.,Keep Your Distance,False,3.7,5.0,2005,"David_Dailey-Gil_Bellows,Melody_Carpenter-Jennifer_Westfeldt,Sean_Voight-Christian_Kane,Susan_Dailey-Kim_Raver,Whit_Harrington-Jamie_Harrold,Holly-Elizabeth_Peña,Brooks_Voight-Stacy_Keach,Kevin-Gary_Anthony_Williams,Dr._Havice-Cynthia_Martells,Gus-Dennis_Burkley,Dream_Girl-Brooke_L._Berry,Dr._Floyd_Beasley-Rick_Overton,Lindsay-Jenny_McShane",Stu_Pollard,suspense,47540.0,115587.0,39797.0
10620,10620,10620,10620,False,,45000000,"Comedy,Family,Romance",,13499,tt0443295,English,"Yours, Mine & Ours","Admiral Frank Beardsley returns to New London to run the Coast Guard Academy, his last stop before a probable promotion to head the Guard. A widower with eight children, he runs a loving but tight ship, with charts and salutes. The kids long for a permanent home. Helen North is a free spirit, a designer whose ten children live in loving chaos, with occasional group hugs. Helen and Frank, high school sweethearts, reconnect at a reunion, and it's love at first re-sighting. They marry on the spot. Then the problems start as two sets of kids, the free spirits and the disciplined preppies, must live together. The warring factions agree to work together to end the marriage.",10.238422,http://img.omdbapi.com/?i=tt0443295&h=600&apikey=f3f2af9c,"Paramount_Pictures,Columbia_Pictures_Corporation,Nickelodeon_Movies,O.N.C._Entertainment,Robert_Simonds_Productions,Sony_Pictures_Entertainment_(SPE),Metro-Goldwyn-Mayer_(MGM),Time_Productions",United_States_of_America,2005-11-23,72028752.0,90.0,English,Released,"18 kids, one house, no way.","Yours, Mine & Ours",False,5.7,233.0,2005,"Frank_Beardsley-Dennis_Quaid,Helen_North-Rene_Russo,William_Beardsley-Sean_Faris,Christina_Beardsley-Katija_Pevec,Harry_Beardsley-Dean_Collins,Michael_Beardsley-Tyler_Patrick_Jones,Kelly_Beardsley-Haley_Ramm,Ethan_Beardsley-Ty_Panitz,Phoebe_North-Danielle_Panabaker,Naoko_North-Miki_Ishikawa,Mick_North-Slade_Pearce,Dylan_North-Drake_Bell,Joni_North-Miranda_Cosgrove,Jimi_North-Lil'_JJ,Commandant_Sherman-Rip_Torn,Mrs._Munion-Linda_Hunt,Max_Algrant-Jerry_O'Connell,Hardware_Store_Worker-Beau_Holden,The_Speed_Racer-Gian_Franco_Tordi",Raja_Gosnell,"big_family,family,blended_family",,,
10731,10731,10731,10731,False,,0,Comedy,,63395,tt0041831,English,A Run for Your Money,"Two Welsh coal-mining brothers win a trip to London to claim a monetary prize. They are supposed to meet a newspaper reporter who will be their escort. Instead, the brothers are launched into an adventure with some London riff-raff. It is up to the reporter to look out for the brothers, and what a job it turns out to be!",0.306905,http://img.omdbapi.com/?i=tt0041831&h=600&apikey=f3f2af9c,Ealing_Studios,United_Kingdom,1949-11-23,0.0,85.0,English,Released,,A Run for Your Money,False,7.0,1.0,1949,"David_""Dai_Number_9""_Jones-Donald_Houston,Thomas_'Twm'_Jones-Meredith_Edwards,Jo-Moira_Lister,Whimple-Alec_Guinness,Huw_Price-Hugh_Griffith",Charles_Frend,,,,
10770,10770,10770,10770,False,,0,"Drama,Comedy,Crime",,2455,tt0086551,French,Vivement dimanche!,"Claude Massoulier is murdered while hunting at the same place as Julien Vercel (Jean-Louis Trintignant), an estate agent who knew him and whose fingerprints are found on Massoulier's car. As the police discover that Marie-Christine Vercel (Caroline Sihol), Julien's wife, was Massoulier's mistress, Julien is the prime suspect. But his secretary, Barbara Becker (Fanny Ardant), while not quite convinced he is innocent, defends him and leads her private investigations.",2.672873,http://img.omdbapi.com/?i=tt0086551&h=600&apikey=f3f2af9c,"Les_Films_du_Carrosse,Soprofilms,Films_A2",France,1983-08-10,0.0,110.0,Français,Released,,Confidentially Yours,False,7.1,25.0,1983,"Barbara_Becker-Fanny_Ardant,Julien_Vercel-Jean-Louis_Trintignant,Maître_Clément-Philippe_Laudenbach,Massoulier-Jean-Pierre_Kalfon,Santelli-Philippe_Morier-Genoud,Marie-Christine_Vercel-Caroline_Sihol,Bertrand_Fabre-Xavier_Saint-Macary,Louison-Jean-Louis_Richard",François_Truffaut,"detective,clerk",2455.0,91064.0,9426.0
10967,10967,10967,10967,False,,0,"Drama,Mystery",,25428,tt0322700,English,I Love Your Work,"A fictional movie star, Gray Evans, goes through the disintegration of his marriage, his gradual mental breakdown, and his increasing obsession with a young film student who reminds Gray of his own life before becoming famous. A dark psychological drama, I Love Your Work explores the pressures of fame and the difference between getting what you want and wanting what you get.",1.224042,http://img.omdbapi.com/?i=tt0322700&h=600&apikey=f3f2af9c,,,2003-10-05,0.0,111.0,Deutsch,Released,,I Love Your Work,False,6.5,2.0,2003,"Jane-Marisa_Coughlan,Samantha-Judy_Greer,Charlotte-Shalom_Harlow,Yehud-Jared_Harris,John-Joshua_Jackson,Goateed_Man-Nicky_Katt,Larry_Hortense-Jason_Lee,Mia_Lang-Franka_Potente,Gray_Evans-Giovanni_Ribisi,Shana-Christina_Ricci,Stiev-Vince_Vaughn",Adam_Goldberg,,,,
11121,11121,11121,11121,False,,0,Documentary,http://www.leonardcohenimyourman.com,57406,tt0478197,English,Leonard Cohen: I'm Your Man,"Poet, singer / songwriter and ladies man Leonard Cohen is interviewed in his home about his life and times. The interview is interspersed with archive photos and exuberant praise and live perfomances from an eclectic mix of musicians, including: Jarvis Cocker, Rufus &amp; Martha Wainwright, Teddy Thompson, Antony Hegarty, The Handsome Family and U2's Bono and The Edge.",0.322965,http://img.omdbapi.com/?i=tt0478197&h=600&apikey=f3f2af9c,"Lionsgate,Sundance_Channel,Horse_Pictures,Con_Artists_Productions",United_States_of_America,2006-09-11,0.0,98.0,English,Released,"A documentary on the legendary singer-songwriter, with performances by those musicians he has influenced.",Leonard Cohen: I'm Your Man,False,6.4,7.0,2006,"Himself-Leonard_Cohen,Herself-Martha_Wainwright,Himself-Rufus_Wainwright,Herself-Beth_Orton,Himself-Jarvis_Cocker,Himself-Bono,Himself-The_Edge,Himself-Nick_Cave",Lian_Lunson,woman_director,,,
11321,11321,11321,11321,False,,0,"Animation,Comedy,Family",,15374,tt0064107,English,A Boy Named Charlie Brown,"Poor Charlie Brown. He can't fly a kite, and he always loses in baseball. Having his faults projected onto a screen by Lucy doesn't help him much either. Against the sage advice and taunting of the girls in his class, he volunteers for the class spelling bee...and wins!",1.852328,http://img.omdbapi.com/?i=tt0064107&h=600&apikey=f3f2af9c,"Cinema_Center_Films,Lee_Mendelson_Film_Productions,Bill_Melendez_Productions,United_Feature_Syndicate_(UFS)",United_States_of_America,1969-12-04,0.0,86.0,"English,Magyar,Italiano",Released,,A Boy Named Charlie Brown,False,5.9,23.0,1969,"Charlie_Brown-Peter_Robbins,Lucy_Van_Pelt-Pamelyn_Ferdin,Linus_Van_Pelt-Glenn_Gilger,Schroeder-Andy_Pforsich,Patty_(voice)-Sally_Dryer,Violet_(voice)_(as_Anne_Altieri)-Ann_Altieri",Bill_Melendez,peanuts,,,
11419,11419,11419,11419,False,,0,"Crime,Drama",,8194,tt0473488,English,A Guide To Recognizing Your Saints,"Dito Montiel, a successful author, receives a call from his long-suffering mother, asking him to return home and visit his ailing father. Dito recalls his childhood growing up in a violent neighborhood in Queens, N.Y., with friends Antonio, Giuseppe, Nerf and Mike.",7.34846,http://img.omdbapi.com/?i=tt0473488&h=600&apikey=f3f2af9c,"Original_Media,Belladonna_Productions,Xingu_Films",United_States_of_America,2006-09-29,516139.0,104.0,"Español,English",Released,Sometimes the only way to move forward is to go back.,A Guide To Recognizing Your Saints,False,6.8,98.0,2006,"Young_Dito-Shia_LaBeouf,Young_Antonio-Channing_Tatum,Dito-Robert_Downey_Jr.,Laurie-Rosario_Dawson,Young_Laurie-Melonie_Diaz,Monty-Chazz_Palminteri,Aunt_Mary-Olga_Merediz,Dito's_Mother-Dianne_Wiest,Diane-Laila_Liliana_Garro,Jenny-Eléonore_Hendricks,Guiseppe-Adam_Scarimbolo,Antonio's_Father-Federico_Castelluccio,Prison_Guard-Chance_Kelly,Queensbridge_Bodega_Man-Gilbert_Cruz,Nerf-Scott_Michael_Campbell",Dito_Montiel,"author,retrospective,queens_new_york_city,childhood",8194.0,48973.0,40478.0
11456,11456,11456,11456,False,,12000000,"Comedy,Drama",,14799,tt0470765,English,For Your Consideration,"Three actors learn that their respective performances in the film ""Home for Purim,"" a drama set in the mid-1940s American South, are generating award-season buzz.",12.142183,http://img.omdbapi.com/?i=tt0470765&h=600&apikey=f3f2af9c,Shangri-La_Entertainment,United_States_of_America,2006-11-22,5542025.0,86.0,English,Released,,For Your Consideration,False,5.9,44.0,2006,"Marilyn_Hack-Catherine_O'Hara,Victor_Allan_Miller-Harry_Shearer,Callie_Webb-Parker_Posey,Brian_Chubb-Christopher_Moynihan,Corey_Taft-John_Michael_Higgins,Pam_Campanella-Carrie_Aizley,Morley_Orfkin-Eugene_Levy,Cindy-Jane_Lynch,Chuck-Fred_Willard,Whitney_Taylor_Brown-Jennifer_Coolidge,Jay_Berman-Christopher_Guest,Simon_Whitset-Jim_Piddock,Sandy_Lane-Ed_Begley_Jr.,Philip_Koontz-Bob_Balaban,Lane_Iverson-Michael_McKean,Studio_Gate_Guard-Stephen_Rannazzisi,Junior_Agent-Simon_Helberg,Martin_Gibb-Ricky_Gervais,Hate_It_Film_Critic-Michael_Hitchcock,Love_It_Film_Critic-Don_Lake,Mary_Pat_Hooligan-Rachael_Harris,Marketing_Person-Richard_Kind,Marketing_Person-Sandra_Oh,Paper_Badge_Sergeant-Paul_Dooley,Paper_Badge_Officer-John_Krasinski,Whitney's_Assistant-Jordan_Black,First_PA-Scott_Adsit,Talk_Show_Host-Craig_Bierko",Christopher_Guest,,,,
11554,11554,11554,11554,False,,20000000,"Action,Comedy,Crime",,14396,tt0462229,English,Code Name: The Cleaner,"Cedric the Entertainer plays Jake, a seemingly regular guy who has no idea who he is after being hit over the head by mysterious assailants. When he finds himself entangled in a government conspiracy, Jake and his pursuers become convinced that he is an undercover agent.",11.107148,http://img.omdbapi.com/?i=tt0462229&h=600&apikey=f3f2af9c,New_Line_Cinema,United_States_of_America,2007-01-05,10337477.0,84.0,English,Released,,Code Name: The Cleaner,False,4.7,78.0,2007,"Jake_Rodgers-Cedric_the_Entertainer,Gina-Lucy_Liu,Diane-Nicollette_Sheridan,Eric_Hauck-Mark_Dacascos,Shaw-Callum_Keith_Rennie,Jacuzzi-Niecy_Nash,Ronnie-DeRay_Davis,Doctor_Soames-Kevin_McNulty,Charlie-Bart_Anderson,Crane-Tom_Butler,The_Butler-Robert_Clarke,Mini_Bar_Attendant-Rick_Tae,Dutch_Dancer-Michael_Boston",Les_Mayfield,,,,
11673,11673,11673,11673,False,,0,Horror,,27313,tt0067229,English,I Drink Your Blood,A band of satanist hippies roll into a town and begin terrorizing the local folk. They rape a local girl and her grandpa goes after them. He fails and is given LSD. This bothers his grandson and he gets back at the hippies by feeding them meat pies infected with blood from a rabid dog. They turn into crazed lunatics and begin killing and/or infecting everything in their path.,2.030342,http://img.omdbapi.com/?i=tt0067229&h=600&apikey=f3f2af9c,,United_States_of_America,1970-01-01,0.0,90.0,English,Released,,I Drink Your Blood,False,6.2,21.0,1970,"Horace_Bones-Bhaskar_Roy_Chowdhury,Sue-Lin-Jadin_Wong,Molly-Rhonda_Fultz,Rollo-George_Patterson,Pete-Riley_Mills,Roger_Davis-John_Damon,Mildred_Nash-Elizabeth_Marner-Brooks,Carrie-Lynn_Lowry,Shelley-Alex_Mann",David_E._Durston,"hippie,grindhouse,motorcycle_gang,rabies,bikies",27313.0,234041.0,82550.0
11714,11714,11714,11714,False,,0,"Comedy,Romance",,50812,tt0088326,English,Unfaithfully Yours,Dudley Moore plays a composer who suspects his wife of cheating. He plots to kill her and frame it on her lover. The whole movie sort of compares his expectations of a perfect result to reality. In the end nothing turns out as planned.,0.650914,http://img.omdbapi.com/?i=tt0088326&h=600&apikey=f3f2af9c,Twentieth_Century_Fox_Film_Corporation,United_States_of_America,1984-02-10,0.0,96.0,English,Released,A beautiful woman is like a symphony. It can drive you crazy if you think someone else is scoring.,Unfaithfully Yours,False,5.8,11.0,1984,"Claude_Eastman-Dudley_Moore,Daniella_Eastman-Nastassja_Kinski,Maxmillian_Stein-Armand_Assante,Norman_Robbins-Albert_Brooks,Carla_Robbins-Cassie_Yates,Giuseppe-Richard_Libertini,Celia-Estelle_Omens",Howard_Zieff,,,,
11734,11734,11734,11734,False,,0,"Drama,Thriller",,15664,tt0458367,English,Right at Your Door,"A dirty bomb goes off in Los Angeles, jamming freeways and spreading a toxic cloud.",4.010441,http://img.omdbapi.com/?i=tt0458367&h=600&apikey=f3f2af9c,,United_States_of_America,2006-01-23,2043704.0,96.0,"English,Italiano,Polski",Released,,Right at Your Door,False,5.8,65.0,2006,"Lexi-Mary_McCormack,Brad-Rory_Cochrane,Alvaro-Tony_Perez,Timmy-Scotty_Noyd_Jr.,Corporal_Marshall-Max_Kasch,Rick-Jon_Huertas,Jason-Will_McCormack,Hardware_Woman-Soledad_St._Hilaire",Chris_Gorak,post-apocalyptic,,,
11736,11736,11736,11736,False,,12000000,Drama,,16727,tt0433416,English,The Namesake,"American-born Gogol, the son of Indian immigrants, wants to fit in among his fellow New Yorkers, despite his family's unwillingness to let go of their traditional ways.",4.273271,http://img.omdbapi.com/?i=tt0433416&h=600&apikey=f3f2af9c,"Fox_Searchlight_Pictures,Mirabai_Films","India,United_States_of_America",2006-09-02,20138836.0,122.0,"বাংলা,Český,English,Français,हिन्दी",Released,Two Worlds. One Journey.,The Namesake,False,6.8,50.0,2006,"Gogol/Nikhil-Kal_Penn,Ashima_Ganguli-Tabu,Ashoke_Ganguli-Irrfan_Khan,Sonali_Ganguli-Sahira_Nair,Maxine_Ratliffe-Jacinda_Barrett,Moushumi_Mazoomdar-Zuleikha_Robinson,Ashoke's_Mother-Ruma_Guha_Thakurta,Ashima's_Father-Sabyasachi_Chakraborty,Ashima's_Grandmother-Supriya_Choudhury",Mira_Nair,"indian_lead,independent_film,woman_director",,,
11937,11937,11937,11937,False,,0,Drama,,33294,tt0347016,Danish,Forbrydelser,"Anna, a young theology graduate, starts work as a prison chaplain. She becomes especially concerned about one inmate, Kate, regarded as difficult and withdrawn, but whom the other inmates credit with mysterious healing powers.",1.580642,http://img.omdbapi.com/?i=tt0347016&h=600&apikey=f3f2af9c,Zentropa_Entertainments,Denmark,2004-01-23,0.0,101.0,Dansk,Released,,In Your Hands,False,5.6,8.0,2004,"Anna-Ann_Eleonora_Jørgensen,Kate-Trine_Dyrholm,Henrik-Nicolaj_Kopernikus,Marion-Sonja_Richter,Jossi-Sarah_Boberg,-Lars_Ranthe,-Henrik_Prip,-Jens_Albinus,-Kirsten_Olesen,-Mette_Munk_Plum,-Benedikte_Hansen,-Petrine_Agger,-Mia_Lyhne,-Helle_Hertz,-Lisbet_Lundquist,-Luna_Worsøe_Mollerup,-Jens_Rosenberg,-Jens_Zacho_Böye,-Lars_Oluf_Larsen,-Marie_Katrine_Rasch,-Luca_Miceli,-Pauli_Ryberg",Annette_K._Olesen,"independent_film,dogme_95,woman_director",33294.0,90248.0,9463.0
12014,12014,12014,12014,False,,0,Comedy,,15581,tt0785077,English,Who's Your Caddy?,"When ""street smart"" rapper Christopher ""C-Note"" Hawkins (Big Boi) applies for a membership to all-white Carolina Pines Country Club, the establishment's proprietors are hardly ready to oblige him.",1.197217,http://img.omdbapi.com/?i=tt0785077&h=600&apikey=f3f2af9c,"The_Weinstein_Company,Dimension_Films,Metro-Goldwyn-Mayer_(MGM)",United_States_of_America,2007-07-27,0.0,93.0,English,Released,,Who's Your Caddy?,False,3.8,18.0,2007,"Valet-Mick_Partridge,C-Note-Big_Boi,Lady_G-Sherri_Shepherd,Himself-Lil_Wayne,Wilson_Cummings-Andy_Milonakis,Big_Large-Faizon_Love,Tank-Terry_Crews,Big_Willie_Johnson-Tony_Cox,Cummings-Jeffrey_Jones,Caddy_Mack-James_Avery,Shannon_Williams-Tamala_Jones",Don_Michael_Paul,sport,,,
12117,12117,12117,12117,False,,24000000,"Comedy,Drama,Romance",,15019,tt0466839,English,I Could Never Be Your Woman,This movie follows a mother who falls for a younger man while her daughter falls in love for the first time. Mother Nature messes with their fates.,11.414893,http://img.omdbapi.com/?i=tt0466839&h=600&apikey=f3f2af9c,"Scott_Rudin_Productions,I_Could_Never_Ltd.,Bauer_Martinez_Studios",United_States_of_America,2007-05-11,9576495.0,97.0,English,Released,Find Yourself. In Love.,I Could Never Be Your Woman,False,5.7,94.0,2007,"Rosie-Michelle_Pfeiffer,Adam-Paul_Rudd,Izzie_Mensforth-Saoirse_Ronan,Brianna-Stacey_Dash,Marty-Fred_Willard,Nathan-Jon_Lovitz,Jeannie-Sarah_Alexander,Mother_Nature-Tracey_Ullman,Melanie-Yasmin_Paige,Taylor-Graham_Norton,Hairdresser-Olivia_Colman,Censor-Steve_Pemberton,Casting_Girl-Archie_Panjabi,Producer-Mackenzie_Crook,Delivery_Boy-Ed_Byrne,David_-_Writer-David_Mitchell,Allergy_Actor-Chike_Chan",Amy_Heckerling,woman_director,,,
