,Unnamed: 0.2,Unnamed: 0.1,Unnamed: 0,adult,belongs_to_collection,budget,genres,homepage,id,imdb_id,original_language,original_title,overview,popularity,poster_path,production_companies,production_countries,release_date,revenue,runtime,spoken_languages,status,tagline,title,video,vote_average,vote_count,year,cast,crew,keywords,movieId,imdbId,tmdbId
19673,19673,19673,19673,False,,0,"Documentary,Horror",http://www.fridaythe13thfilms.com,15004,tt1282052,English,His Name Was Jason: 30 Years of Friday the 13th,"A retrospective documentary about the groundbreaking horror series, Friday the 13th, featuring interviews with cast and crew from the twelve films spanning 3 decades.",6.353353,http://img.omdbapi.com/?i=tt1282052&h=600&apikey=f3f2af9c,Paramount_Pictures,United_States_of_America,2009-02-03,0.0,90.0,"English,Français",Released,,His Name Was Jason: 30 Years of Friday the 13th,False,7.0,25.0,2009,"Herself-Diane_Almeida,Himself-Erich_Anderson,Herself-Judie_Aronson,Herself-Diana_Barrows,Himself-Steven_Barton,Herself-Rachel_Belofsky,Himself-Peter_Bracke,Himself-Richard_Brooker,Himself-John_Carl_Buechler,Himself-Chuck_Campbell,Herself-Gloria_Charles,Himself-Stuart_Charno,Himself-Barney_Cohen,Himself-Mike_Cucinotta,Himself-Sean_S._Cunningham,Himself-Douglas_Curtis,Herself-Jensen_Daggett,Himself-Steve_Dash,Herself-Darcy_DeMoss,Himself-Bob_DeSimone,Scream_Queen-Elissa_Dowling,Himself-John_Furey,Himself-Warrington_Gillette,Himself-C.J._Graham,Himself-Adam_Green,Himself-Seth_Green,Himself-Kane_Hodder,Himself-David_Kagen,Herself-Elizabeth_Kaitan,Herself-Adrienne_King,Himself-Ken_Kirzinger,Himself-Paul_Kratka,Himself-Ari_Lehman,Himself-Harry_Manfredini,Himself-Tom_McLoughlin,Himself-Derek_Mears,Himself-Lawrence_Monoson,Herself-Camilla_More,Herself-Carey_More,Himself-Gregory_Nicotero,Herself-Betsy_Palmer,Herself-Lar_Park_Lincoln,Herself-Catherine_Parks,Himself-Bill_Randolph,Himself-Peter_Mark_Richman,Herself-Amanda_Righetti,Himself-Shavar_Ross,Himself-Tom_Savini,Himself-John_Shepherd,Himself-Kevin_Spirtas,Herself-Amy_Steel,Himself-Danny_Steinmann,Herself-Lauren-Marie_Taylor,Himself-Anthony_Timpone,Himself-Russell_Todd,Himself-Travis_Van_Winkle,Herself-Deborah_Voorhees,Himself-Dick_Wieand,Himself-Larry_Zerner,Himself-Joseph_Zito",Daniel_Farrands,"mass_murder,murder,director,horror_movie,jason_vorhees,tv_documentary,censorship,film_production",,,
19846,19846,19846,19846, - Written by Ørnås,,/ff9qCepilowshEtG2GYWwzt2bs4.jpg,"Carousel_Productions,Vision_View_Entertainment,Telescene_Film_Group_Productions","[{'iso_3166_1': 'CA', 'name': 'Canada'}, {'iso_3166_1': 'LU', 'name': 'Luxembourg'}, {'iso_3166_1': 'GB', 'name': 'United Kingdom'}, {'iso_3166_1': 'US', 'name': 'United States of America'}]",1997-08-20,0,104.0,"[{'iso_639_1': 'en', 'name': 'English'}]",Released,,http://img.omdbapi.com/?i=0&h=600&apikey=f3f2af9c,,,1,,,,,,,,,,NaT,,,,,,
20125,20125,20125,20125,False,,0,"Romance,Comedy",,147590,tt0091935,Unknown_language_[cn],殺妻二人組,"Two men, Yun-Fat Chow and Kenny Bee, are both married and unhappy. Together they make diverse plans to murder their wifes.",0.093311,http://img.omdbapi.com/?i=tt0091935&h=600&apikey=f3f2af9c,Go_Go_Film_Productions,Hong_Kong,1986-09-24,0.0,92.0,广州话 / 廣州話,Released,,100 Ways to Murder Your Wife,False,4.0,1.0,1986,"Fa-Chow_Yun-fat,Fang-Anita_Mui,Hsiao_Hsien-Joey_Wong,Roberto-Kenny_Bee,Chen_Chih-Tao-Anthony_Chan",Kenny_Bee,slapstick,,,
20210,20210,20210,20210,False,,0,Comedy,,61658,tt0419673,French,Dans tes rêves,"Ninth is a promising young rapper whose reputation does not exceed even the few streets of his neighborhood. With his band and supported by Keuj, hairdresser apprentice producer, he tries to attend concerts and trying to break into the music, to the chagrin of his mother, who would see him in a more conventional career at the post office...",0.590099,http://img.omdbapi.com/?i=tt0419673&h=600&apikey=f3f2af9c,,France,2005-04-13,0.0,0.0,Français,Released,,In Your Dreams,False,5.0,2.0,2005,"Ixe-Sérigne_M'Baye,Soraya-Blandine_Bury,Ben-Vincent_Elbaz,La_femme_de_Keuj-Sara_Martins,Keuj-Edouard_Montoute,Ava-Béatrice_Dalle,Jenny-Léa_Drucker,Wilson-Simon_Abkarian,Mike-Jean-Pierre_Cassel,Nicaise-Firmine_Richard,Mojo-Alex_Descas,Belly-Khalid_Maadour,Gun-Tony_Harrisson,Acteur-Gianni_Giardinelli,Régis-Simon_Buret,Acteur-Ali_Karamoko",Denis_Thybaud,,,,
20398,20398,20398,20398,False,,0,"Crime,Thriller",http://www.crime2012.co.kr/,89501,tt2082221,Korean,범죄와의 전쟁,"A corrupted customs officer, Choi Ik-hyeon, faces losing his job. Then, his life turns around as he meets ganster Choi Hyeong-bae who has connection with the Yakuza. They quickly form a partnetship; Hyeong-bae helps Ik-hyeon set up a business with the money from drug trafficking while Ik-hyeon lobbies for his partner Hyeong-bae. As the government declares war on crime, however, their partnership begins to crack.",5.765418,http://img.omdbapi.com/?i=tt2082221&h=600&apikey=f3f2af9c,"Showbox/Mediaplex,㈜팔레트픽처스",South_Korea,2012-02-02,0.0,133.0,한국어/조선말,Released,War against Crime: Golden Age of the Bad Guys,Nameless Gangster,False,6.7,51.0,2012,"Choi_Ik-hyun-Choi_Min-sik,Jo_Beomseok-Kwak_Do-won,Choe_Hyeongbae-Ha_Jung-woo,Gim_Seobang-Ma_Dong-seok,Bak_Changu-Kim_Sung-kyun,Night_Club_Manager-Kim_Hye-Eun,Detective_Kim-Yoo_Jae-Myung,Kim_Pan-ho-Cho_Jin-woong",Yoon_Jong-bin,"police,cop,gangster,crime,south_korea,decomposition,1980s,bad_guy",89501.0,1466072.0,47753.0
20648,20648,20648,20648,False,,0,Comedy,,143796,tt0207145,French,Tant qu'on a la santé,"This anthology film from Étaix’s peak period presents four comic episodes with an accent on the pitfalls of modern life: (1) a scary vampire novel keeps a man awake, (2) a moviegoer’s attempts to find a seat give way to an onslaught of absurd ads, (3) noise and pollution send a man to the doctor’s, (4) a hunter disrupts a rural idyll. In French with English subtitles. (Martin Rubin, Gene Siskel Film Center)",0.436688,http://img.omdbapi.com/?i=tt0207145&h=600&apikey=f3f2af9c,"CAPAC,Les_Films_de_la_Colombe",France,1966-02-25,0.0,64.0,Français,Released,,As Long as You've Got Your Health,False,6.3,4.0,1966,"Pierre-Pierre_Étaix,-Denise_Péronne,-Simone_Fonder,-Sabine_Sun",Pierre_Étaix,"hunter,cinema,vampire,fence",,,
20660,20660,20660,20660,False,,0,"Comedy,Drama",,74052,tt0781533,Spanish,Yo soy la Juani,A pair of women leave their small town and dud boyfriends behind for fun in Madrid.,1.052711,http://img.omdbapi.com/?i=tt0781533&h=600&apikey=f3f2af9c,"Televisión_Española_(TVE),Media_Films,El_Virgili_Films",Spain,2006-10-20,0.0,100.0,Español,Released,,My Name Is Juani,False,3.5,12.0,2006,"Juani-Verónica_Echegui,Jonah-Dani_Martín,Vane-Laya_Martí,Nacho-Gorka_Lasaosa,Futbolista-Carles_Francino",Bigas_Luna,,,,
20918,20918,20918,20918,False,,0,"Drama,Action,Thriller,Science_Fiction,Foreign",,78432,tt1410272,German,Min Dit: The Children of Diyarbakir,"After their parents are murdered, two young Kurdish children are forced to live on the street",0.521868,http://img.omdbapi.com/?i=tt1410272&h=600&apikey=f3f2af9c,"Corazón_International,Bezar_Film",Germany,2009-09-19,0.0,102.0,"Deutsch,,Türkçe",Released,,Before Your Eyes,False,7.4,7.0,2009,"Gülîstan-Senay_Orak,Firat-Muhammed_Al,Nuri_Kaya-Hakan_Karsak,Zelal-Suzan_Ilir,Dilan_'Dilara'-Berîvan_Ayaz",Miraz_Bezar,,,,
21358,21358,21358,21358,False,,0,"Drama,Comedy",http://www.pathefilms.com/film/le-prenom,112198,tt2179121,French,Le Prénom,"Vincent, a wealthy real estate agent, is invited to dinner by his sister Elizabeth and her husband Peter, both professors in Paris. Claude, a childhood friend and trombonist in a symphony orchestra, is also present. Vincent brings news from the prenatal examination of his and his wife Anna's unborn son.  The name chosen by the soon-to-be parents strongly offends the others for many reasons. The dispute between the guests quickly escalates and before long the resurgence of old grudges and hidden secrets is unavoidable ...",7.038718,http://img.omdbapi.com/?i=tt2179121&h=600&apikey=f3f2af9c,"M6_Films,TF1_Films_Production,Canal+,Nexus_Factory,Pathé,uFilm,M6,Le_Tax_Shelter_du_Gouvernement_Fédéral_de_Belgique,Chapter_2,uFund","France,Belgium",2012-04-25,0.0,109.0,"Français,Deutsch",Released,A child is the beginning of happiness. A name is the beginning of despair.,What's in a Name,False,7.2,433.0,2012,"Vincent-Patrick_Bruel,Élisabeth-Valérie_Benguigui,Pierre-Charles_Berling,Claude-Guillaume_de_Tonquédec,Anna-Judith_El_Zein,Françoise-Françoise_Fabian,Livreur_pizza-Yaniss_Lespert,Infirmière_bracelet-Miren_Pradier,Apollin-Alexis_Leprise,Myrtille-Juliette_Levant,L'obstétricien-Bernard_Murat",Alexandre_de_La_Patellière,,,,
21374,21374,21374,21374,False,,0,Documentary,,61330,tt1600841,English,Please Remove Your Shoes,"A documentary about the US government's broken promise to keep our airlines secure, and the personal stories of a few people who know the truth - congressmen, air marshals, aviation security employees. It will make you angry and flying in an airplane may never be the same again.",0.165904,http://img.omdbapi.com/?i=tt1600841&h=600&apikey=f3f2af9c,,,2010-07-01,0.0,0.0,,Released,Catching a Flight Will Never Be the Same Again,Please Remove Your Shoes,False,5.8,3.0,2010,,,,,,
21417,21417,21417,21417,False,,0,Drama,,23431,tt1085362,English,An Angel Named Billy,"Mark Anderson, a recent stroke victim who is frail and weak. Also, his best friend Thomas, a classic over the hill drag queen desperate for love and happiness. Mark and Thomas have a master plan, to find Mark's son, James Anderson the love of his life once and for all.",0.187181,http://img.omdbapi.com/?i=tt1085362&h=600&apikey=f3f2af9c,,,2007-01-11,0.0,120.0,English,Released,,An Angel Named Billy,False,0.0,1.0,2007,"Billy-Dustin_Belt,Donna-Allison_Fleming,Nancy-Amy_London,Zack-Matt_Prokop,Rondell-Robin_Dionne,Mark-Richard_Lewis_Warren,Thomas-Buddy_Daniels",Greg_Osborne,,,,
21491,21491,21491,21491,False,,0,"Family,Science_Fiction",,77664,tt0101343,English,And You Thought Your Parents Were Weird,"Two boys follow in their late fathers foot steps by inventing weird and wonderful gadgets. Trouble lies ahead when after a halloween party the spirit of their father ends up in the latest invention, a robot.",0.000578,http://img.omdbapi.com/?i=tt0101343&h=600&apikey=f3f2af9c,Panorama,United_States_of_America,1991-11-15,402539.0,92.0,English,Released,,And You Thought Your Parents Were Weird!,False,6.0,3.0,1991,"Sarah_Carson-Marcia_Strassman,Josh_Carson-Joshua_John_Miller,Max_Carson-Edan_Gross,Walter_Kotzwinkle-John_Quade,Steve_Franklin-Sam_Behrens,Matthew_Carson_/_Newman_(voice)-Alan_Thicke,Alice_Woods-Susan_Gibney,Jeager-Gustav_Vintas,Beth_Allen-A._J._Langer",Tony_Cookson,"boy,teenager,robot,family",,,
21731,21731,21731,21731,False,I_Spit_on_Your_Grave_Collection,0,"Thriller,Horror,Crime",,207768,tt2537176,English,I Spit on Your Grave 2,"Naturally beautiful, Katie has just settled into New York where she, like many other young women, is trying to make it as a model. But what starts out as an innocent and simple photo shoot soon turns into something disturbingly unthinkable! Raped, tortured and kidnapped to a foreign country, Jessica is buried alive and left to die. Against all odds, she manages to escape. Severely injured, she will have to tap into the darkest places of the human psyche to not only survive, but to exact her revenge…",12.75872,http://img.omdbapi.com/?i=tt2537176&h=600&apikey=f3f2af9c,Cinetel_Films,"Bulgaria,United_States_of_America",2013-08-25,809.0,106.0,"български език,English",Released,,I Spit on Your Grave 2,False,5.9,281.0,2013,"Katie-Jemma_Dallender,Ivan-Joe_Absolom,Georgy-Yavor_Baharov,Nicolay-Aleksandar_Aleksiev,Ana-Mary_Stockley,Jayson-Michael_Dixon,Father_Dimov-Valentine_Pelka,Valko-Peter_Silverleaf,Kiril-George_Zlatarev",Steven_R._Monroe,"pornography,rape,sex,exploitation,adult,bulgaria,american_express",,,
21941,21941,21941,21941,False,,0,Drama,,197926,tt0048623,English,Sincerely Yours,"He dazzled America for decades with his musical artistry. Now fans as well as those curious about this exciting entertainer’s unique appeal can relive the Liberace magic in his only starring film, Sincerely Yours. In a poignant story scripted by Irving Wallace, Liberace plays a concert pianist threatened by deafness. Plunged into despair, he finds escape from personal sorrow by secretly involving himself in the problems of strangers. Liberace touches the heart and delights the ear with sparkling renditions of 31 selections from Chopin to Chopsticks. Along the way he romances Joanne Dru and Dorothy Malone, trades barbs with old pro William Demarest and in a warmly humorous nightclub scene, pokes fun at his own image as the 1950s matinee idol of the little-old-lady set. From beginning to end, Sincerely Yours perfectly captures the charisma and sheer musicality of the legendary Mr. Showmanship.",0.900521,http://img.omdbapi.com/?i=tt0048623&h=600&apikey=f3f2af9c,"Warner_Bros.,International_Artists",United_States_of_America,1955-11-05,0.0,115.0,English,Released,,Sincerely Yours,False,5.0,1.0,1955,"Anthony_Warrin-Liberace,Marion_Moore-Joanne_Dru,Linda_Curtis-Dorothy_Malone,Howard_Ferguson-Alex_Nicol,Sam_Dunne-William_Demarest,Sarah_Cosgrove-Lori_Nelson,Mrs._McGinley-Lurene_Tuttle,Alvie_Hunt-Richard_Eyer,Grandpa_Hunt-James_Bell,J._R._Aldrich-Herbert_Heyes,Mrs._Cosgrove_(uncredited)-Barbara_Brown",Gordon_Douglas,,,,
22021,22021,22021,22021,False,,1030064,"Drama,Romance,Thriller",,157370,tt1311071,English,Kill Your Darlings,"A murder in 1944 draws together the great poets of the beat generation: Allen Ginsberg, Jack Kerouac and William Burroughs.",7.075031,http://img.omdbapi.com/?i=tt1311071&h=600&apikey=f3f2af9c,Killer_Films,United_States_of_America,2013-10-04,0.0,104.0,English,Released,A true story of obsession and murder.,Kill Your Darlings,False,7.1,455.0,2013,"Allen_Ginsberg-Daniel_Radcliffe,Lucien_Carr-Dane_DeHaan,Edie_Parker-Elizabeth_Olsen,David_Kammerer-Michael_C._Hall,William_Burroughs-Ben_Foster,Jack_Kerouac-Jack_Huston,Naomi_Ginsberg-Jennifer_Jason_Leigh,Marian_Carr-Kyra_Sedgwick,Louis_Ginsberg-David_Cross,Dean-David_Rasche,Professor_Steeves-John_Cullum,Permissions_Librarian-Brenda_Wehle,Gwendolyn-Erin_Darke,Businessman-Craig_Chester,DA_Secretary-Lenore_Harris,Edith_Cohen-Leslie_Meisel",John_Krokidas,,,,
22768,22768,22768,22768,False,,0,Foreign,,100409,tt1414368,English,Over Your Cities Grass Will Grow,"The film bears witness to German artist Anselm Kiefer's alchemical creative processes and renders in film, as a cinematic journey, the personal universe he has built at his hill-studio estate in the South of France.",0.186806,http://img.omdbapi.com/?i=tt1414368&h=600&apikey=f3f2af9c,,,2011-10-27,0.0,105.0,,Released,,Over Your Cities Grass Will Grow,False,7.7,3.0,2011,,Sophie_Fiennes,woman_director,,,
22873,22873,22873,22873,False,,0,,,133018,tt0088193,English,A Streetcar Named Desire,"Blanche Dubois goes to visit her pregnant sister and husband Stanley in New Orleans. Stanley doesn't like her, and starts pushing her for information on some property he know was left to the sisters. He discovers she has mortgaged the place and spent all the money, and wants to find out all he can about her. Even more friction develops between the two while they are in the apartment together...",1.1622,http://img.omdbapi.com/?i=tt0088193&h=600&apikey=f3f2af9c,,,1984-03-04,0.0,119.0,,Released,,A Streetcar Named Desire,False,5.0,1.0,1984,"Blanche_DuBois-Ann-Margret,Stanley_Kowalski-Treat_Williams,Stella_Kowalski-Beverly_D'Angelo,Harold_Mitchell-Randy_Quaid,Actor-Dan_Hewitt_Owens",John_Erman,,,,
22874,22874,22874,22874,False,,0,,,133021,tt0114565,English,A Streetcar Named Desire,"Blanche Dubois goes to visit her pregnant sister and husband Stanley in New Orleans. Stanley doesn't like her, and starts pushing her for information on some property he know was left to the sisters. He discovers she has mortgaged the place and spent all the money, and wants to find out all he can about her. Even more friction develops between the two while they are in the apartment together...",1.355359,http://img.omdbapi.com/?i=tt0114565&h=600&apikey=f3f2af9c,,,1995-10-24,0.0,156.0,,Released,,A Streetcar Named Desire,False,6.0,6.0,1995,"Stanley_Kowalski-Alec_Baldwin,Blanche_DuBois-Jessica_Lange,Harold_'Mitch'_Mitchell-John_Goodman,Stella_Kowalski-Diane_Lane",Glenn_A._Jordan,,,,
22994,22994,22994,22994,False,,0,"Animation,Family",http://www.pixar.com/short_films/Home-Entertainment-Shorts/Your-Friend-the-Rat,13061,tt1134859,English,Your Friend the Rat,"Let's face it, rats are not the most beloved creatures on earth. However, maybe this little tale about the history of human and rat interaction will change the world's tune. At least that is the hope of Remy, the star of Ratatouille, and his reluctant brother Emile as they guide us through world history from a rat's perspective. Why can't we all just get along?",7.311671,http://img.omdbapi.com/?i=tt1134859&h=600&apikey=f3f2af9c,Pixar_Animation_Studios,United_States_of_America,2007-11-06,0.0,11.0,English,Released,,Your Friend the Rat,False,6.7,67.0,2007,"Remy-Patton_Oswalt,Emile-Peter_Sohn,Linguini-Lou_Romano,Norwegian_Rat-Sigmund_Vik,Director_Voice-Jim_Capobianco,Disclaimer_guy-Tony_Russel",Jim_Capobianco,"chef,rat,short,pixar_animation,ratatouille",,,
23371,23371,23371,23371,False,,1000000,"Drama,Romance,Science_Fiction",http://inyoureyesmovie.com,226448,tt2101569,English,In Your Eyes,"Two seemingly unconnected souls from different corners of the United States make a telepathic bond that allows them to see, hear and feel the other's experiences, creating a bond that apparently can't be broken.",8.448518,http://img.omdbapi.com/?i=tt2101569&h=600&apikey=f3f2af9c,"Night_and_Day_Pictures,Bellwether_Pictures",United_States_of_America,2014-04-20,0.0,105.0,English,Released,Two strangers. One extraordinary connection.,In Your Eyes,False,7.1,275.0,2014,"Rebecca_Porter-Zoe_Kazan,Dylan_Kershaw-Michael_Stahl-David,Donna-Nikki_Reed,Diane-Jennifer_Grey,Phillip-Mark_Feuerstein,Bo-Steve_Howey,Lyle-David_Gallagher,Giddons-Steve_Harris,Dr._Maynard-Reed_Birney,Male_Nurse-Tom_Choi,Stan-Bill_Thorpe",Brin_Hill,"telepathy,new_mexico,loneliness,ex-con,offbeat",,,
23629,23629,23629,23629,False,,0,Drama,,62876,tt0055569,French,Un nommé La Rocca,"Roberto goes to Marseilles to give a hand to his friend Xavier, wrongly imprisoned following a frame-up organized by his associate Villanova. Roberto sets out to seduce Villanova's mistress, but when Villanova is killed, Roberto ends up leader of the band...",0.409034,http://img.omdbapi.com/?i=tt0055569&h=600&apikey=f3f2af9c,"Da_Ma_Produzione,Les_Films_du_Cyclope","France,Italy",1961-11-17,0.0,102.0,Français,Released,,A Man Named Rocca,False,6.5,2.0,1961,"Roberto_La_Rocca-Jean-Paul_Belmondo,Geneviève_Adé-Christine_Kaufmann,Xavier_Adé-Pierre_Vaneck,Maud-Béatrice_Altariba,Ficelle-Henri_Virlojeux,Charlot_l'élégant-Mario_David,Villanova-Nico,Migli-Pedro_Serano,Cipriano-Charles_Moulin,Névada-Jean-Pierre_Darras,-Edmond_Beauchamp,Jack_Léonard-Jacques_Léonard,-Jean_Gras,Le_chef_des_racketteurs_américains-Michel_Constantin,Fanfan-Frédéric_Lambre,Le_directeur_de_la_prison-Claude_Piéplu,-Jean-Louis_Marest,-Henri_Arius,-Mick_Besson,-Pierre_Mirat,Un_prisonnier_démineur_(uncredited)-Gérard_Hernandez,uncredited-Giovanni_Père,uncredited-Jacques_Rispal,Un_prisonnier_démineur_(uncredited)-Dominique_Zardi",Jean_Becker,"falsely_accused,marseille",,,
23703,23703,23703,23703,False,How_to_Train_Your_Dragon_Collection,145000000,"Fantasy,Action,Adventure,Animation,Comedy,Family",http://www.howtotrainyourdragon.com/,82702,tt1646971,English,How to Train Your Dragon 2,"The thrilling second chapter of the epic How To Train Your Dragon trilogy brings back the fantastical world of Hiccup and Toothless five years later. While Astrid, Snotlout and the rest of the gang are challenging each other to dragon races (the island's new favorite contact sport), the now inseparable pair journey through the skies, charting unmapped territories and exploring new worlds. When one of their adventures leads to the discovery of a secret ice cave that is home to hundreds of new wild dragons and the mysterious Dragon Rider, the two friends find themselves at the center of a battle to protect the peace.",12.256689,http://img.omdbapi.com/?i=tt1646971&h=600&apikey=f3f2af9c,"DreamWorks_Animation,Mad_Hatter_Entertainment",United_States_of_America,2014-06-12,609123048.0,102.0,English,Released,The training is over.,How to Train Your Dragon 2,False,7.6,3163.0,2014,"Hiccup_(voice)-Jay_Baruchel,Stoick_the_Vast_(voice)-Gerard_Butler,Ruffnut_(voice)-Kristen_Wiig,Snotlout_(voice)-Jonah_Hill,Valka_(voice)-Cate_Blanchett,Drago_Bludvist_(voice)-Djimon_Hounsou,Eret,_Son_of_Eret_(voice)-Kit_Harington,Fishlegs_(voice)-Christopher_Mintz-Plasse,Tuffnut_(voice)-T.J._Miller,Astrid_(voice)-America_Ferrera,Gobber_(voice)-Craig_Ferguson,Hoark_the_Haggard_(voice)-Kieron_Elliott,Starkard_(voice)-Philip_McGrade,Ug_(voice)-Andrew_Ableson,Teeny_(voice)-Gideon_Emery,No-Name_(voice)-Simon_Kassianides,Toothless_(voice)-Randy_Thom",Dean_DeBlois,"father_son_relationship,wife_husband_relationship,sacrifice,viking,sequel,rescue,dragon,mother_son_relationship,death_of_husband,warrior,3d",,,
23903,23903,23903,23903,False,,0,"Mystery,Thriller",,208284,tt2733258,French,L'étrange couleur des larmes de ton corps,"A woman vanishes. Her husband inquires into the strange circumstances of her disappearance. Did she leave him? Is she dead? As he goes along searching, he plunges into a world of nightmare and violence...",1.998366,http://img.omdbapi.com/?i=tt2733258&h=600&apikey=f3f2af9c,,"Luxembourg,Belgium,France",2013-08-12,7182.0,102.0,"Dansk,Français",Released,,The Strange Color of Your Body's Tears,False,6.0,41.0,2013,"Dan_Kristensen-Klaus_Tange,The_Inspector-Jean-Michel_Vovk,-Sylvia_Camarda,-Sam_Louwyck,Barbara-Anna_D'Annunzio",Hélène_Cattet,"detective,nudity,wife,investigation,suspense,disappearance,giallo,husband,woman_director",,,
23922,23922,23922,23922,False,,0,Drama,http://hideyoursmilingfaces.com/,163710,tt1964773,English,Hide Your Smiling Faces,"Tommy and his older brother Eric live in the midst of vast remote forests. The death of their friend pushes them close to the edge. Eric doesn’t know how to channel his energy. All at once, nature’s vastness feels stifling.",1.602963,http://img.omdbapi.com/?i=tt1964773&h=600&apikey=f3f2af9c,Flies,United_States_of_America,2014-03-25,0.0,81.0,English,Released,,Hide Your Smiling Faces,False,6.3,20.0,2014,"Tommy-Ryan_Jones,Eric-Nathan_Varnson,Ian's_Father-Colm_O'Leary,Tristan-Thomas_Cruz,Mother-Christina_Starbuck,Father-Chris_Kies,Blake-Andrew_M._Chamberlain,Religious_Man-Clark_Middleton,Ian-Ivan_Tomić",Daniel_Patrick_Carbone,friendship,,,
24102,24102,24102,24102,False,,15,Music,,212769,tt1828959,English,Make Your Move,A pair of star-crossed dancers in New York find themselves at the center of a bitter rivalry between their brothers' underground dance clubs.,6.792607,http://img.omdbapi.com/?i=tt1828959&h=600&apikey=f3f2af9c,CJ_Entertainment,South_Korea,2013-08-07,122.0,110.0,English,Released,Move to your beat. Move to your moment. Move to your love.,Make Your Move,False,6.2,30.0,2013,"Donny-Derek_Hough,Aya-BoA,Kaz-Will_Yun_Lee,Tatiana-Izabella_Miko,Natsumi-Miki_Ishikawa,Nick-Wesley_Jonathan,Raphael-Michael_Mando,Parole_Officer_Foster-Dan_Lauria,Camille_Young-Mary_Ashton,Rei-Tiffany_Daniels,Child_Drummer-Kolton_Stewart",Duane_Adler,,,,
24753,24753,24753,24753,False,,0,"Action,Drama,War",,74974,tt0088934,English,Code Name: Emerald,"In april 1944, an allied agent is sent to France in order to rescue an ""overlord"" captured by the Germans. (An ""overlord"" is one of the few men who knew the date and place of the ""D"" day). To achieve this goal, he will be supported by a secret friend of the allies, a very important German officer and the French resistance. But the nazi SS is not resting...",0.658885,http://img.omdbapi.com/?i=tt0088934&h=600&apikey=f3f2af9c,"NBC,Metro-Goldwyn-Mayer_(MGM)",United_States_of_America,1985-09-07,0.0,95.0,English,Released,,Code Name: Emerald,False,6.0,2.0,1985,"Gus_Lang-Ed_Harris,Jürgen_Brausch-Max_von_Sydow,Walter_Hoffman-Horst_Buchholz,Ernst_Ritter-Helmut_Berger,Claire_Jouvet-Cyrielle_Clair,Andy_Wheeler-Eric_Stoltz,Colonel_Peters-Patrick_Stewart,Sir_Geoffrey_Macklin-Graham_Crowden,Major_Seltz-George_Mikell,Dieter_Träger-Gabriel_Barylli,Johann-Peter_Bonke,Patrick_Callaghan-Tony_Rohr,Andre-Henri_Lambert,Willoughby-Ray_Armstrong,Jasmine-Julie_Jézéquel",Jonathan_Sanger,,,,
24764,24764,24764,24764,False,,0,"Comedy,Drama",,65612,tt0094002,French,Soigne ta droite,"This film is made up several sketches in which certain actors play several real or fictional roles to a background of rock music. The lead character, played by Godard himself, is an annoyingly perfectionist film-maker determined to wring every last drop of the finest performance possible from his stars.",0.416594,http://img.omdbapi.com/?i=tt0094002&h=600&apikey=f3f2af9c,,"France,Switzerland",1987-09-19,0.0,82.0,Français,Released,,Keep Your Right Up,False,5.3,4.0,1987,"l'Idiot_ou_le_Prince-Jean-Luc_Godard,la_cigale-Jane_Birkin,l'Individu-Jacques_Villeret,L'homme-François_Périer",Jean-Luc_Godard,,65612.0,92732.0,52886.0
