,Unnamed: 0.2,Unnamed: 0.1,Unnamed: 0,adult,belongs_to_collection,budget,genres,homepage,id,imdb_id,original_language,original_title,overview,popularity,poster_path,production_companies,production_countries,release_date,revenue,runtime,spoken_languages,status,tagline,title,video,vote_average,vote_count,year,cast,crew,keywords,movieId,imdbId,tmdbId
62,62,62,62,False,,0,Comedy,,10607,tt0116126,English,Don't Be a Menace to South Central While Drinking Your Juice in the Hood,"When Ashtray (Shawn Wayans) moves to South Central L.A. to live with his father (who appears to be the same age he is) and grandmother (who likes to talk tough and smoke reefer), he falls in with his gang-banging cousin Loc Dog (Marlon Wayans), who along with the requisite pistols and Uzi carries a thermo-nuclear warhead for self-defense. Will Ashtray be able to keep living the straight life?",11.700115,http://img.omdbapi.com/?i=tt0116126&h=600&apikey=f3f2af9c,"Miramax_Films,Island_Pictures,Ivory_Way_Productions",United_States_of_America,1996-01-12,0.0,89.0,"English,Español",Released,"Finally, the movie that proves that Justice isn't always Poetic, Jungle Fever isn't always pretty, and Higher Learning can be a waste of time.",Don't Be a Menace to South Central While Drinking Your Juice in the Hood,False,6.2,192.0,1996,"Ashtray-Shawn_Wayans,Loc_Dog-Marlon_Wayans,Dashiki-Tracey_Cherelle_Jones,Preach-Chris_Spencer,Ashtray's_Mother-Vivica_A._Fox,Sister_Williams-Rappin'_Granny,Crazy_Legs-Suli_McCullough,Officer_Self_Hatred-Bernie_Mac,Rufus-Faizon_Love,Mailman-Keenen_Ivory_Wayans,Mrs._Johnson-Kim_Wayans,Loc_Dog's_Grandma-Helen_Martin,Loc_Dog's_Mom-Virginia_Watson,Toothpick-Darrel_Heath",Paris_Barclay,"date,slang,hip-hop,cousin,parody,hood,gang,social_satire,racism,gangster",,,
470,470,470,470,False,,13000000,Drama,,7984,tt0107207,English,In the Name of the Father,"A small time thief from Belfast, Gerry Conlon, is falsely implicated in the IRA bombing of a pub that kills several people while he is in London. He and his four friends are coerced by British police into confessing their guilt. Gerry's father and other relatives in London are also implicated in the crime. He spends fifteen years in prison with his father trying to prove his innocence.",7.405895,http://img.omdbapi.com/?i=tt0107207&h=600&apikey=f3f2af9c,,"United_Kingdom,Ireland",1993-12-12,65796862.0,133.0,English,Released,Falsely accused. Wrongly imprisoned. He fought for justice to clear his father's name.,In the Name of the Father,False,7.6,363.0,1993,"Gerry_Conlon-Daniel_Day-Lewis,Giuseppe_Conlon-Pete_Postlethwaite,Gareth_Peirce-Emma_Thompson,Paul_Hill-John_Lynch,Robert_Dixon-Corin_Redgrave,Carole_Richardson-Beatie_Edney,Chief_PO_Barker-John_Benfield,Benbay-Paterson_Joseph,Sarah_Conlon-Marie_Jones,Detective_Pavis-Gerard_McSorley,Ronnie_Smalls-Frank_Harper,Paddy_Armstrong-Mark_Sheppard,Joe_McAndrew-Don_Baker,Detective-Martin_Murphy,Girl_in_Pub-Alison_Crosbie,Guildford_Soldier-Philip_King,IRA_Man_1-Nye_Heron,Danny-Anthony_Brophy,Tommo-Frankie_McCafferty,Soldier-Paul_Warriner,Soldier-Julian_Walsh,Soldier-Stuart_Wolfenden,Bin_Lady-Jo_Connor,Female_Rioter-Karen_Carlisle,IRA_Woman-Fiona_Daly,Girl_in_Commune-Saffron_Burrows,Deptford_Jim-Jamie_Harris,Annie_Maguire-Britta_Smith,Hooker's_Driver-Stanley_Townsend,Detective-Tim_Perrin,Detective-Tony_Denham,Detective-Rob_Spendlove,Detective-Phil_Davis,Detective-Richard_Graham,Detective-Oliver_Maguire,Policewoman-Rachael_Dowling,Policewoman-Tina_Kellegher,Paddy_Maguire-Ronan_Wilmot,Forensic_Scientist-Alistair_Findlay,Remand_Prison_Officer-Peter_Howitt,Remand_Prison_Officer-Sean_Lawlor,Remand_Prison_Officer-Brian_de_Salvo,Remand_Prison_Officer-Luke_Hayden,Trial_Judge-Aiden_Grennell,Prosecutor-Daniel_Massey,Defense_Counsel-Bosco_Hogan,Prison_Officer-Dave_Duffy,Cockney_Prisoner-Mal_Whyte,Cockney_Prisoner-Marcus_Lynch,Prisoner_John_O'Brien-Jer_O'Leary,Prisoner-Paul_O'Grady,Prisoner-Terry_O'Neill,Home_Office_Official-Malcolm_Tierney,Priest-Peter_Sheridan,Archivist_Jenkins-Alan_Barry,Scottish_Governor-Jonathan_Ryan,Appeal_Prosecutor-Tom_Wilkinson,Appeal_Judge-Denys_Hawthorne",Jim_Sheridan,"bomb,prison,father_son_relationship,based_on_novel,1970s,biography,faith,irish,trial,rebellion,torture,terrorism,courtroom",7984.0,91083.0,14510.0
1081,1081,1081,1081,False,,1800000,Drama,,702,tt0044081,English,A Streetcar Named Desire,Disturbed Blanche DuBois moves in with her sister in New Orleans and is tormented by her brutish brother-in-law while her reality crumbles around her.,7.301719,http://img.omdbapi.com/?i=tt0044081&h=600&apikey=f3f2af9c,"Charles_K._Feldman_Group,Warner_Bros.",United_States_of_America,1951-09-18,8000000.0,125.0,English,Released,"...Blanche, who wanted so much to stay a lady...",A Streetcar Named Desire,False,7.6,291.0,1951,"Blanche_DuBois-Vivien_Leigh,Stanley_Kowalski-Marlon_Brando,Stella_Kowalski-Kim_Hunter,Harold_Mitchell-Karl_Malden,Steve-Rudy_Bond,Pablo_Gonzales-Nick_Dennis,Eunice-Peg_Hillias,A_Collector-Wright_King,A_Doctor-Richard_Garrick,The_Matron-Ann_Dere,The_Mexican_Woman-Edna_Thomas,A_Sailor-Mickey_Kuhn,Foreman_(uncredited)-Mel_Archer,Giggling_Woman_with_Eunice_(uncredited)-Marietta_Canty,Passerby_(uncredited)-John_George,Policeman_(uncredited)-Lyle_Latell,Passerby_(uncredited)-Charles_Wagenheim,Vendor_(uncredited)-Buck_Woods,Minor_Role_(uncredited)-Dahn_Ben_Amotz",Elia_Kazan,"southern_usa,rape,sister_sister_relationship,loss_of_sense_of_reality,brother-in-law,violent_husband,new_orleans,middle_aged_woman,brother-in-law_sister-in-law_relationship,light_bulb,expectant_father,off_screen_rape",702.0,62952.0,753.0
1398,1398,1398,1398,False,,0,"Drama,Comedy,Romance,Foreign",,43775,tt0109949,Spanish,Guantanamera,,0.496315,http://img.omdbapi.com/?i=tt0109949&h=600&apikey=f3f2af9c,,"Spain,Germany,Cuba",1995-01-01,0.0,105.0,Español,Released,,Guantanamera,False,8.0,3.0,1995,"Adolfo-Carlos_Cruz_,Candido-Raúl_Eguren_,Ramon-Pedro_Fernández_,Tony-Luis_Alberto_García,Mariano-Jorge_Perugorría,Georgina-Mirta_Ibarra,Yoyita-Conchita_Brando,Iku-Suset_Pérez_Malberti",Tomás_Gutiérrez_Alea,,,,
1569,1569,1569,1569,False,,0,"Comedy,Romance",,33657,tt0120151,English,A Smile Like Yours,A comedy about a couple who cannot conceive a baby,2.507368,http://img.omdbapi.com/?i=tt0120151&h=600&apikey=f3f2af9c,"Paramount_Pictures,Rysher_Entertainment",United_States_of_America,1997-08-27,0.0,98.0,English,Released,The shortest distance between two people is a certain smile.,A Smile Like Yours,False,3.2,6.0,1997,"Danny_Robertson-Greg_Kinnear,Jennifer_Robertson-Lauren_Holly,Nancy_Tellen-Joan_Cusack,Steve_Harris-Jay_Thomas,Lindsay_Hamilton-Jill_Hennessy,Richard_Halstrom-Christopher_McDonald,Dr._Felber-Donald_Moffat,Dr._Chin-France_Nuyen,Nurse_Wheeler-Marianne_Muellerleile,Holly-Sheridan_Samples,Woman_in_Window_/_Woman_on_Plane-Barbara_Larsen,Welder-Tony_Abou-Ganim,Welder-Nick_Scoggin,Karaoke_Act_2-Nicholas_Bearde,Karaoke_Act_3-June_Carryl,Karaoke_Act_3-Latrice_Sellers,Karaoke_Act_3-Lynda_Marie_Sellers,Baseball_Buddy-Paul_Ghiringhelli,Baseball_Buddy-Richard_Thorn,Pool_Hall_Guy-T._Michael_Sutton,Clinic_Video_Narrator_(voice)-Ben_Stein,Woman_at_Fertility_Clinic-Meggan_Kimberley,Pregnant_Mother-Nancy_Carlin,Surrell_Board_Member-Tony_Amatullo,Surrell_Board_Member-Brad_Rivers,Woman_Entering_Fertility_Clinic-Terri_Orth-Pallavicini,Maitre_D'-Michael_Santo,Guy_on_Plane-James_Cranna,Perky_Airline_Representative-Marle_Gaines,Taxi_Driver-Charlie_Holliday,Angry_Flight_Attendant-Helen_Swee,Woman_on_Plane-Joy_Michiel,Nancy_Tellen's_Groom-Jim_Burk,Helicopter_Pilot-Robert_'Bobby_Z'_Zajonc,Restaurant_Patron-Trenton_Brisco,Nancy_Tellen's_Friend_at_Lunch-Monique_Carmona,Restaurant_Patron-Jane_Scatena,Girl_in_Club-Angel_Sessions,Ticket_Agent_(uncredited)-Flynn_Beck,Pregnant_Woman_(uncredited)-Kristy_Connelly,Nurse_(uncredited)-Karen_Lenore_Dawson,Pool_Player_(uncredited)-Bob_Grochau,Outside_Waitress_(uncredited)-Kristy_King,Man_on_Airplane-Scott_Allen_Logan,Martha_(uncredited)-Shirley_MacLaine,Man_on_Airplane_(uncredited)-Scott_Allen_Logan,Man_on_Airplane_(uncredited)-Tod_Purvis,Welder_(uncredited)-Marciano_Ricky,San_Francisco_Giants_Fan_(uncredited)-Peggy_Sandow",Keith_Samples,,,,
2068,2068,2068,2068,False,,5000000,"Drama,Comedy",,77469,tt0119517,English,Your Friends & Neighbors,"This adult comedy follows six characters, three men and three women from a cross-section of social groups, as they play sexual power games. When an affair fires up between 2 of the married characters, it sparks a chain of consequences for all of them, including one of the wives falling for another woman!",1.564774,http://img.omdbapi.com/?i=tt0119517&h=600&apikey=f3f2af9c,"Propaganda_Films,PolyGram_Filmed_Entertainment",United_States_of_America,1998-02-04,4710749.0,100.0,English,Released,A modern immorality tale.,Your Friends & Neighbors,False,5.9,17.0,1998,"Mary-Amy_Brenneman,Barry-Aaron_Eckhart,Jerry-Ben_Stiller,Cheri-Nastassja_Kinski,Cary-Jason_Patric,Terri-Catherine_Keener",Neil_LaBute,"impotence,male_friendship,extramarital_affair,unhappiness",,,
2366,2366,2366,2366,False,,20000000,"Drama,Thriller,Mystery",,192,tt0091605,English,The Name of the Rose,"14th-century Franciscan monk William of Baskerville and his young novice arrive at a conference to find that several monks have been murdered under mysterious circumstances. To solve the crimes, William must rise up against the Church's authority and fight the shadowy conspiracy of monastery monks using only his intelligence – which is considerable.",11.469751,http://img.omdbapi.com/?i=tt0091605&h=600&apikey=f3f2af9c,"Zweites_Deutsches_Fernsehen_(ZDF),Les_Films_Ariane,RAI_Radiotelevisione_Italiana,Cristaldifilm","France,Italy,Germany",1986-09-24,77200000.0,130.0,"English,Latin",Released,"Who, in the name of God, is getting away with murder?",The Name of the Rose,False,7.2,739.0,1986,"William_of_Baskerville-Sean_Connery,Adso_of_Melk-Christian_Slater,Remigio_de_Varagine-Helmut_Qualtinger,Severinus-Elya_Baskin,The_Abbot-Michael_Lonsdale,Malachia-Volker_Prechtel,Jorge_de_Burgos-Feodor_Chaliapin_Jr.,Ubertino_da_Casale-William_Hickey,Berengar-Michael_Habeck,Venantius-Urs_Althaus,The_Girl-Valentina_Vargas,Salvatore-Ron_Perlman,Michele_da_Cesena-Leopoldo_Trieste,Adelmo-Lars_Bodin-Jorgensen,Papal_Envoy-Giordano_Falzoni,Jerome_of_Kaffa-Franco_Valobra,Hugh_of_Newcastle-Vernon_Dobtcheff,Pietro_d'Assisi-Donald_O'Brien,Cuthbert_of_Winchester-Andrew_Birkin,Bernardo_Gui-F._Murray_Abraham,Cardinal_Bertrand-Lucien_Bodard,Jean_d'Anneaux-Peter_Berling,Vescovo_di_Alborea-Pete_Lancaster,Monaco-Franco_Adducci,Monaco-Niko_Brücher,Monaco-Aristide_Caporale,Monaco-Fabio_Carfora,Monaco-Francesco_Scali,Monaco-Peter_Clös,Monaco-Mario_Diano,Monaco-Franco_Pistoni,Monk-Maria_Tedeschi,Monaco-Valerio_Isidori,Monaco-Luigi_Leoni,Monaco-Armando_Marra,monaco-Ludger_Pistor,inviato_papale-Franco_Diogene",Jean-Jacques_Annaud,"christianity,library,inquisition,monk,poison,secret_passage,labyrinth,rich,middle_ages,persecution,medieval,franciscan,burned_at_the_stake,poor,murder_mystery,theological_debate",192.0,114435.0,56088.0
2380,2380,2380,2380,False,,0,"Drama,Romance",,8129,tt0151691,English,My Name Is Joe,"Two thirtysomethings, unemployed former alcoholic Joe and community health worker Sarah, start a romantic relationship in the one of the toughest Glasgow neighbourhoods.",1.878973,http://img.omdbapi.com/?i=tt0151691&h=600&apikey=f3f2af9c,"Channel_Four_Films,Arte,Diaphana_Films,The_Glasgow_Film_Fund,Parallax_Pictures,Degeto_Film,Westdeutscher_Rundfunk_(WDR),Tornasol_Films,Alta_Films,La_Sept_Cinéma,Road_Movies_Vierte_Produktionen,Scottish_Arts_Council_Lottery_Fund","Germany,United_Kingdom,Spain,Italy,France",1998-05-15,0.0,105.0,English,Released,,My Name Is Joe,False,7.1,29.0,1998,"Joe-Peter_Mullan,Sarah-Louise_Goodall,Liam-David_McKay,McGowan-David_Hayman,Shanks-Gary_Lewis,Maggie-Lorraine_McIntosh,Mojo-Stephen_McCole",Ken_Loach,"glasgow,funeral,american_football_coach,professional_soccer_player,debt,soccer",8129.0,181810.0,51182.0
2492,2492,2492,2492,False,,2900000,"Drama,Thriller",,1902,tt0125659,Spanish,Abre los ojos,"A very handsome man finds the love of his life, but he suffers an accident and needs to have his face rebuilt by surgery after it is severely disfigured.",8.842959,http://img.omdbapi.com/?i=tt0125659&h=600&apikey=f3f2af9c,"Les_Films_Alain_Sarde,Las_Producciones_del_Escorpion,Lucky_Red,Canal+_España,Sociedad_General_de_Televisión_(Sogetel)",Spain,1997-12-19,368234.0,117.0,Español,Released,,Open Your Eyes,False,7.4,211.0,1997,"César-Eduardo_Noriega,Sofía-Penélope_Cruz,Antonio-Chete_Lera,Pelayo-Fele_Martínez,Núria-Najwa_Nimri,Duvernois-Gérard_Barray,Encargado_L.E.-Jorge_de_Juan,Commisario-Miguel_Palenzuela,Médico_Jefe-Pedro_Miguel_Martínez,Recluso_paranoico-Ion_Gabella,Guardia-Joserra_Cadiñanos,Camarero-Tristán_Ulloa",Alejandro_Amenábar,"love_triangle,madrid,love_of_one's_life,ladykiller,face_operation,fall_from_skyscraper,virtual_reality,life_extension,car_crash,best_friend,psychiatrist,psychiatric",1902.0,116141.0,32284.0
2888,2888,2888,2888,False,James_Bond_Collection,28000000,"Adventure,Action,Thriller",http://www.mgm.com/view/movie/695/For-Your-Eyes-Only/,699,tt0082398,English,For Your Eyes Only,A British spy ship has sunk and on board was a hi-tech encryption device. James Bond is sent to find the device that holds British launching instructions before the enemy Soviets get to it first.,9.765123,http://img.omdbapi.com/?i=tt0082398&h=600&apikey=f3f2af9c,"United_Artists,Eon_Productions","United_Kingdom,United_States_of_America",1981-06-23,195312802.0,127.0,"ελληνικά,English,Italiano",Released,"No one comes close to James Bond, 007.",For Your Eyes Only,False,6.3,497.0,1981,"James_Bond-Roger_Moore,Melina_Havelock-Carole_Bouquet,Milos_Columbo-Chaim_Topol,Bibi_Dahl-Lynn-Holly_Johnson,Aristotle_Kristatos-Julian_Glover,Countess_Lisl_von_Schlaf-Cassandra_Harris,Jacoba_Brink-Jill_Bennett,Emile_Leopold_Locque-Michael_Gothard,Erich_Kriegler-John_Wyman,Sir_Timothy_Havelock-Jack_Hedley,Miss_Moneypenny-Lois_Maxwell,Q-Desmond_Llewelyn,Sir_Frederick_Gray-Geoffrey_Keen,General_Anatol_Gogol-Walter_Gotell,Tanner-James_Villiers,Ferrara-John_Moreno,Claus-Charles_Dance,Karageorge-Paul_Angelis,Iona_Havelock-Toby_Robins,Apostis-Jack_Klaff,Santos-Alkis_Kritikos,Nikos-Stag_Theodore,Hector_Gonzales-Stefan_Kalipha,First_Sea_Lord-Graham_Crowden,Vice_Admiral-Noel_Johnson,McGregor-William_Hoyland,Bunky-Paul_Brooke,Vicar-Fred_Bryant,Girl_in_Flower_Shop-Robbin_Young,Mantis_Man-Graham_Hawkes,Denis_Thatcher-John_Wells,The_Prime_Minister-Janet_Brown,Sharon,_Q's_Assistant_(uncredited)-Maureen_Bennett,Guard_at_St._Cyril_(uncredited)-Andy_Bradford,Smithers-Jeremy_Bulloch,González_Henchman_(uncredited)-Clive_Curtis,Girl_at_Pool_(uncredited)-Lalla_Dean,Girl_at_Pool_(uncredited)-Evelyn_Drogue,Herself_-_Singer_in_Title_Sequence_(uncredited)-Sheena_Easton,Rublevich-Eva_Rueber-Staier",John_Glen,"london_england,submarine,england,sea,assassin,mountain,undercover,olympic_games,drug_traffic,secret_mission,secret_intelligence_service,kgb,coral_reef,ski_jump,parrot,cryptographic_device,gang_of_smugglers,figure_skating,motorcycle,monastery,british_secret_service,skiing",699.0,103095.0,277270.0
3234,3234,3234,3234,False,,0,"Comedy,Drama",,139058,tt0061801,English,I'll Never Forget What's'isname,"Advertising golden boy Andrew Quint is fed up with his fabulously successful life. In very dramatic fashion, he quits his job to return to writing for a small literary magazine. He wants to leave his former life behind, going as far as saying good-bye to his wife and mistresses. He finds, however, that it's not so easy to escape the past.",0.29714,http://img.omdbapi.com/?i=tt0061801&h=600&apikey=f3f2af9c,Scimitar_Productions,United_Kingdom,1967-12-18,0.0,97.0,English,Released,"He smashed up his desk, gave up a wife, three mistresses and went back to the simple life. Then his troubles really started!",I'll Never Forget What's'isname,False,7.0,3.0,1967,"Jonathan_Lute-Orson_Welles,Andrew_Quint-Oliver_Reed,Georgina_Elben-Carol_White,Gerald_Sater-Harry_Andrews,Headmaster-Michael_Hordern,Louise_Quint-Wendy_Craig,Nicholas-Norman_Rodway,Josie-Marianne_Faithfull,Chaplain-Frank_Finlay,Carla-Ann_Lynn,Charles_Maccabee-Harvey_Hall,Susannah-Lyn_Ashley,-Basil_Dignam,Michael_Cornwall-Mark_Burns,Kellaway-Mark_Eden,Lewis_Force-Stuart_Cooper,Anna-Veronica_Clifford,Eldrich-Roland_Curram,Bankman-Peter_Graves,Galloway-Robert_Mill,Walter-Edward_Fox",Michael_Winner,advertising,139058.0,253225.0,78210.0
3255,3255,3255,3255,False,,0,"Fantasy,Drama,Comedy",,12186,tt0101698,English,Defending Your Life,"In an afterlife resembling the present-day US, people must prove their worth by showing in court how they have demonstrated courage.",3.711347,http://img.omdbapi.com/?i=tt0101698&h=600&apikey=f3f2af9c,"Geffen_Pictures,Warner_Bros.",United_States_of_America,1991-03-22,0.0,112.0,"English,日本語",Released,The first true story of what happens after you die.,Defending Your Life,False,6.5,65.0,1991,"Daniel_Miller-Albert_Brooks,Julia-Meryl_Streep,Bob_Diamond-Rip_Torn,Lena_Foster-Lee_Grant,Agency_Head-Michael_Durrell,Daniel's_Judge-Lillian_Lehman,Daniel's_Father-S._Scott_Bullock,Dick_Stanley,_Daniel's_substitute_attorney-Buck_Henry,Jeep_Owner-James_Eckhouse,Victorian_Girl-Noley_Thornton,Shirley_MacLaine-Shirley_MacLaine,Waitress-Mary_Pat_Gleason,Elderly_Woman_on_Tram-Maxine_Elliott_Hicks,Comedian-Roger_Behr,Martin-Alex_Sheafe,Daniel's_Judge-George_Wallace,Steve-Ethan_Embry",Albert_Brooks,"heaven,afterlife",,,
3440,3440,3440,3440,False,,0,Drama,,27857,tt0093776,English,Prick Up Your Ears,"Stephen Frears directs this biographical drama focusing on controversial British playwright Joe Orton (Gary Oldman), revealed in flashback after his murder by lover Kenneth Halliwell (Alfred Molina).  Born in 1933 in Leicester, in the English Midlands, John 'Joe' Orton moves to  London in 1951, to study at RADA, and enjoys an openly gay relationship with Halliwell in their famous Islington flat in the 1960s. However, when Orton achieves spectacular success with such plays as 'What the Butler Saw' and 'Loot', Halliwell begins to feel alienated and the pair's future looks increasingly uncertain.",3.328585,http://img.omdbapi.com/?i=tt0093776&h=600&apikey=f3f2af9c,civilhand,United_Kingdom,1987-04-17,0.0,111.0,English,Released,,Prick Up Your Ears,False,6.1,27.0,1987,"Joe_Orton-Gary_Oldman,Kenneth_Halliwell-Alfred_Molina,Peggy_Ramsay-Vanessa_Redgrave,Leonie_Orton-Frances_Barber,Anthea_Lahr-Lindsay_Duncan,Elsie_Orton-Julie_Walters,John_Lahr-Wallace_Shawn,Mrs._Sugden-Janet_Dale,Mr_Sugden-Dave_Atkins,Mr._Sloane_Actor-Garry_Cooper,Actor_2-Roger_Lloyd_Pack,Orton's_Friends-Sean_Pertwee,Orton's_Friends-Helena_Michell,Miss_Battersby-Selina_Cadell,Policeman-Neil_Dudgeon,Psychiatrist-Richard_Wilson,Simon_Ward-Steven_Mackintosh,Douglas_Orton-Karl_Johnson,Undertaker-David_Bradley,Anthea's_Mother-Joan_Sanderson,Constable-Spencer_Leigh,Police_Inspector-Neville_Smith,Chauffeur-John_Salthouse,Brian_Epstein-David_Cardy,Wigmaker-John_Moffatt,Mr_Cunliffe-Charles_McKeown,Madame_Lambert-Margaret_Tyzack,William_Orton-James_Grant,Education_Officer-Eric_Richard,RADA_Chairman-William_Job,RADA_Judge-Rosalind_Knight,RADA_Judge-Angus_MacKay,RADA_Instructor-Linda_Spurrier,Janet-Charlotte_Wodehouse,Magistrate-Bert_Parnaby,Brickie-Liam_De_Staic,Counsel-Antony_Carrick,Publisher-Christopher_Guinee,Kenneth-Stevan_Rimkus,BBC_Actor-Michael_Müller,BBC_Actor_2-Anthony_Douse,Director-John_Kane,Stage_Manager-Joanne_Connelly,Philip-Noel_Davis,Peggy_Ramsey's_Secretary-Philippa_Davies,Gallery_Owner-Julie_Legrand,Woman_in_Gallery-Jane_Blackburn,Woman_in_Gallery_2-Stella_Richman,Youth_Outside_Lavatory-Jonny_Phillips,Man_Outside_Lavatory-Richard_Ireson,Moroccan_Boy_1-Ahmed_Elgheur,Moroccan_Boy_2-Moktar_Dagmouni,Marilyn_Orton-Sian_Thomas,George_Barnett-Stephen_Bill,Awards_Chairman-Max_Stafford-Clark,Undertaker's_Boy-Simon_Adams,Beatle's_Chauffeur-Mark_Brignal,Mortuary_Attendant-Robin_Hooper,Beatles_Chauffeur-Mark_Brignal,Patrick_Proktor-Derek_Jarman",Stephen_Frears,"gay,england,based_on_novel",27857.0,382330.0,464.0
4124,4124,4124,4124,False,,0,Documentary,,65075,tt0206187,English,Keep the River on Your Right: A Modern Cannibal Tale,"In 1955, Tobias Schneebaum disappeared into the depths of the Peruvian Amazon. He had no guide, no map, and only the vaguest of instructions: Keep the river on your right. A year later Schneebaum emerged from the jungle…naked, covered in body paint, and a modern-day cannibal.  Titled after Schneebaum’s 1969 cult classic memoir about his formative experiences living in the Amazon, Keep The River On Your Right is the extraordinary stranger-than-fiction story of Schneebaum’s return to the jungle, 45 years after his original visit, to reunite with the very tribesmen he loved and who gave him nightmares for nearly half a century. A deeply affecting and searing portrait, sibling filmmakers Laurie and David Shapiro capture a man in utter conflict, a fearless adventurer, and one of the most charming, enigmatic, and perplexing men ever captured on screen.",0.122334,http://img.omdbapi.com/?i=tt0206187&h=600&apikey=f3f2af9c,,United_States_of_America,2000-04-15,0.0,82.0,"English,Español",Released,,Keep the River on Your Right: A Modern Cannibal Tale,False,8.0,3.0,2000,"-Tobias_Schneebaum,-Norman_Mailer,-Michael_Nelson_Rockefeller",Laurie_Gwen_Shapiro,"cultural_difference,woman_director",,,
4601,4601,4601,4601,False,,20000000,"Drama,Action,Comedy,Western,Music",,20391,tt0064782,English,Paint Your Wagon,"A Michigan farmer and a prospector form a partnership in the California gold country. Their adventures include buying and sharing a wife, hijacking a stage, kidnapping six prostitutes, and turning their mining camp into a boom town. Along the way there is plenty of drinking, gambling, and singing. They even find time to do some creative gold mining.",10.648872,http://img.omdbapi.com/?i=tt0064782&h=600&apikey=f3f2af9c,"Paramount_Pictures,Malpaso_Productions,Alan_Jay_Lerner_Productions",United_States_of_America,1969-10-15,31678778.0,158.0,"English,Español",Released,Stake Your Claim To The Musical Goldmine of '69!,Paint Your Wagon,False,6.3,65.0,1969,"Ben_Rumson-Lee_Marvin,Pardner-Clint_Eastwood,Elizabeth-Jean_Seberg,Rotten_Luck_Willie-Harve_Presnell,Mad_Jack_Duncan-Ray_Walston,Horton_Fenty-Tom_Ligon,Parson-Alan_Dexter,Horace_Tabor-William_O'Connell,Atwell-Robert_Easton,Foster-Geoffrey_Norman,Jacob_Woodling-John_Mitchum,Sarah_Woodling-Sue_Casey,Hennessey-Roy_Jenson",Joshua_Logan,"mining,prospector",,,
4977,4977,4977,4977,False,,0,"Romance,Comedy,Drama",,4267,tt0078122,French,Préparez vos mouchoirs,"Solange is depressed: she's stopped smiling, she eats little, she says less. She has fainting fits. Her husband Raoul seeks to save her by enlisting Stephane, a stranger, to be her lover. Although he listens to Mozart and has every Pocket Book arranged in alphabetical order, Stephane fails to cheer Solange. She knits. She does housework. Everyone, including their neighbor a vegetable vendor, agrees that she needs a child, yet she fails to get pregnant by either lover. The three take a job running a kids' summer camp where they meet Christian, the precocious 13-year-old son of the local factory manager. It is Christian who restores Solange to laughter",2.411369,http://img.omdbapi.com/?i=tt0078122&h=600&apikey=f3f2af9c,"CAPAC,Belga_Films",France,1978-01-11,0.0,108.0,Français,Released,,Get Out Your Handkerchiefs,False,6.9,18.0,1978,"Raoul-Gérard_Depardieu,Stéphane-Patrick_Dewaere,Solange-Carole_Laure,le_voisin-Michel_Serrault,Mme_Beloeil-Eléonore_Hirt,M._Beloeil-Jean_Rougerie,Christian_Beloeil-Riton_Liebman,la_passante-Sylvie_Joly,Le_docteur_Rue-Michel_Beaune,La_barmaid-Liliane_Rovère",Bertrand_Blier,"wife_husband_relationship,1970s,bisexuality,classical_music,stricken",4267.0,203755.0,2144.0
5021,5021,5021,5021,False,,0,"Comedy,Drama",,13791,tt0207524,English,How to Kill Your Neighbor's Dog,"The story of Peter McGowan, a chain-smoking, impotent, insomniac playwright who lives in Los Angeles. Once very successful, he is now in the tenth year of a decade-long string of production failures. He finds himself bonding with a new neighbor's lonely young daughter who has mild cerebral palsy; and during one of his middle-of-the-night strolls, he encounters his oddball doppelgänger.",6.38471,http://img.omdbapi.com/?i=tt0207524&h=600&apikey=f3f2af9c,,"Germany,United_States_of_America",2002-02-22,0.0,107.0,English,Released,,How to Kill Your Neighbor's Dog,False,6.5,22.0,2002,"Peter_McGowan-Kenneth_Branagh,Melanie_McGowan-Robin_Wright,Amy_Walsh-Suzi_Hofrichter,Edna-Lynn_Redgrave,False_Peter-Jared_Harris,Larry-Peter_Riegert,Brian_Sellars-David_Krumholtz,Adam-Johnathon_Schaech,Victoria-Kaitlin_Hopkins,Allana-Suzy_Joachim,Janitor-Brett_Rickaby,Trina_Walsh-Lucinda_Jenney,Amy's_Father-Derek_Kellock,Babysitter-Stacy_Hogue,Debra_Salhany-Peri_Gilpin,Laura_Leeton-Tamala_Jones,Female_Anchor-Benita_Ha,Male_Anchor-Mark_Brandon",Michael_Kalesniko,"screenplay,rage_and_hate,alzheimer,stalker,independent_film,neighbor,dog,doppelganger",,,
